{
  "apiVersion": "navocms.io/v0alpha1",
  "kind": "MediaAsset",
  "metadata": {
    "id": "81111111-1111-4111-8111-111111111111",
    "tenantId": "82222222-2222-4222-8222-222222222222",
    "siteId": "83333333-3333-4333-8333-333333333333",
    "createdAt": "2026-08-24T00:00:00.000Z"
  },
  "spec": {
    "state": "ready",
    "original": {
      "sha256": "aaaaaaaaaaaaaaaaaaaaaaaaaaaaaaaaaaaaaaaaaaaaaaaaaaaaaaaaaaaaaaaa",
      "byteSize": 1200,
      "mediaType": "image/jpeg",
      "storageKey": "tenants/82222222-2222-4222-8222-222222222222/sites/83333333-3333-4333-8333-333333333333/originals/aaaaaaaaaaaaaaaaaaaaaaaaaaaaaaaaaaaaaaaaaaaaaaaaaaaaaaaaaaaaaaaa",
      "width": 40,
      "height": 30,
      "frames": 1
    },
    "variants": [],
    "provenance": { "kind": "upload", "receivedAt": "2026-08-24T00:00:00.000Z", "receivedBy": "84444444-4444-4444-8444-444444444444" },
    "rights": { "license": "CC-BY-4.0", "restricted": false }
  }
}
